,Unnamed: 0,text,label
1083,,I was going to go to the movies with a bunch of friends. But they all bailed on me and now I have to go alone.,loneliness
1084,,my daughter went on vacation with her friends and the house feels really alone without her,loneliness
1085,,My wife has been out of the country for 2 months for school. It's been a little tough being alone at home ever night.,loneliness
1086,,I recently moved from California to North Carolina. It was ok while my friend (who drove me across the country) was here. But after he left I realized I knew absolutely nobody. It was not a good feeling.,loneliness
1087,,I work from home and sometimes it makes me a bit sad to know that I'm here alone.,loneliness
1088,,I used to feel lonely a lot as a teenager,loneliness
1089,,I recently got together with some old college buddies and we just spend a weekend sitting around talking about the good ole times.,loneliness
1090,,A friend of mine is moving away. It's a shame because we were close for a few years.,loneliness
1091,,I am kind of glad the summer is coming to a end my kids was gone all summer I missed them and I was very isolated when they was away.,loneliness
1092,,"I've been married a long time, but my husband has to travel for business so I feel a little bit by myself sometimes.",loneliness
1093,,Me and my friend used to play nintendo all day long.,loneliness
1094,,I recently moved to a new city. I left behind some good friends.,loneliness
1095,,I was upset when my family kept leaving me on vacation,loneliness
1096,,My friends went to dinner without me. I thought they'd call for sure.,loneliness
1097,,I'm very socially awkward.,loneliness
1098,,I was all alone when my family left for the weekend.,loneliness
1099,,"I was feeling a bit apprehensive lately, since my children are going back to school. One to college, the other to high school. They grow up so fast!",loneliness
1100,,My roommate has been gone all week. I don't have anything to do without him here.,loneliness
1101,,My roommate is gone for the week. I can't stand being alone in the apartment.,loneliness
1102,,My best friend is moving to another town and i dont know when i will get to see her again.,loneliness
1103,,I started thinking about the last time I hung out with a group of friends before moving away.,loneliness
1104,,Two years ago my wife and I got divorced. It's been very strange in this big house all by myself.,loneliness
1105,,My husband works long hours. I hate being by myself specially at night.,loneliness
1106,,My wife has been out of the country for 2 months.,loneliness
1107,,"when my wife left me a year ago i went a little stir crazy. it was so silent in the house, i had to get out and make new friends.",loneliness
1108,,I recently said goodbye to a good friend for a while. I love her!,loneliness
1109,,One time I moved to a new city and didn't know anyone. I had to go out alone to do things,loneliness
1110,,"After moving to Dallas from a small town I felt I would like it, but after a few weeks of not knowing anyone I got home sick.",loneliness
1111,,This new trailer for Spyro Remastered really has me thinking about the times I used to play the original. The old friend I played it with I don't keep in touch with anymore.,loneliness
1112,,"I had a rough day, my husband has been out of town and the weather has been bad.",loneliness
1113,,"My youngest child started high school this year. It made me think back to when she was just started kindergarten, and how time flies!",loneliness
1114,,My wife has been out of the country for a couple months for school. Dropping her off at the airport was really tough.,loneliness
1115,,"Half of my family didn't show up for my kids 6th birthday, it was upsetting to say the least. She was looking forward to seeing them.",loneliness
1116,,"My husband used to work out of town in a different state Sunday through Thursday. Even though my kids were with me and we kept to our usual routine, I still missed him very badly when he was gone. Every Sunday after he left, I would cry.",loneliness
1117,,Besides my cats being with me I am always alone at home all the kids are grown and moved out.,loneliness
1118,,My wife went out of town for a girls weekend and I sat at home with the dog for 3 days by myself.,loneliness
1119,,"I hate being alone so much, my husband works a lot of hours. He also works over an hour away that makes it rough.",loneliness
1120,,"My wife has been out of the country for school for a month and a half. She gets back in a couple weeks, but it's starting to get tough being alone with just the dogs.",loneliness
1121,,Recently I've been feeling that I don't need a company to feel wholesome.,loneliness
1122,,When I was younger my mom would always have to go on a week long training for work every year and I would always miss her so much.,loneliness
1123,,I miss my family,loneliness
1124,,"I was looking at old pictures of my friends and I. I sometimes wish I could go back to those days, at least for a while.",loneliness
1125,,I am sad that my friends don't visit me.,loneliness
1126,,Today was the first day of school for my kids. It's been so quiet here.,loneliness
1127,,i miss watching chiller theatre with my family on fridays,loneliness
1128,,I was sad the other day because I found out a friend is moving. It's not that far and I didnt see her a lot anyway but still.,loneliness
1129,,I was pulling into the gas station and this kid felt the need to not only almost hit me but also call me extremely awful names.,abuse
1130,,I get so annoyed and angry when I hear of people being mean to animals. These helpless animals have no clue why people are so mean either.,abuse
1131,,"Someone ran into my car while I was grocery shopping. I came out to a huge dent in my car, I was so mad.",abuse
1132,,"When I was in middle school there was this boy that sat in front of me in 8th, he was always trying to get me to kiss him before class started.",abuse
1133,,A guy pulled a REALY big knife out on my husband at a gas station once.,abuse
1134,,"Once, I came home from a night out and my room was ransacked. My roommate was an alcoholic, and he had even thrown some of my belongings in the bathtub. Of course, he didn't remember doing it either.",abuse
1135,,I came outside this morning and found my car had been broken into. I was very upset and frusterated,abuse
1136,,This guy at school follows me around.,abuse
1137,,They arrested 9 people at a nearby farm for animal cruelty and they are already out on bond!,abuse
1138,,When people try to control me,abuse
1139,,"I went to the zoo last month, I haven't been since I was a kid. I went to a zoo that was supposed to be one of the top zoos, however I couldn't help but feel bad for the animals the whole time.",abuse
1140,,Someone side sideswiped my car last night while I was sleeping and I wasn't aware until I woke up. It was not a good thing to wake up to.,abuse
1141,,Someone ran over my mailbox this morning. They left it totally demolished.,abuse
1142,,Somebody stole a package from my front yard yesterday.,abuse
1143,,I was appalled at the way my friend approached me last night.,abuse
1144,,I found a rabbit that had been shot by someone in my yard.,abuse
1145,,I woke up this morning with car damage that happened while I was sleeping.,abuse
1146,,I am disgusted because of my friends pulling pranks on me.,abuse
1147,,"I was listening to old school rap in my car. The windows were down, and the car next to me started making fun of me.",abuse
1148,,I get so mad when I watch shows about animal shelters and see how many people abuse animals.,abuse
1149,,"Last week, someone during the night drove off the road and destroyed a large section of my fence. It is going to be expensive to have it replaced.",abuse
1150,,A guy cut in front of some people in a line at a store and I confronted him. He flipped me off and we exchanged very heated words. The confrontation almost got physically but finally he left.,abuse
1151,,The police officer tried to harass me.,abuse
1152,,"I saw a kid beat up a dog the other day, I felt angry.",abuse
1153,,"It was my birthday and My friend sent me a birthday card with a gift card in a mail... i never got it, somebody stole it!",abuse
1154,,"Walking home alone from school one day, three young adults jumped in front of me and yelled in my twelve-year old face. I cried the rest of the way back.",abuse
1155,,it was really hard to hear that there was a shooting in a gas station near me and there was 3 vitims i was really devastated,abuse
1156,,"It really makes me sad to think there are people who treat animals like trash, animal cruelty is a really serious matter.",abuse
1157,,Someone stole my credit card information. They have been charging up my card like crazy. I'm scared about my identity.,abuse
1158,,"One time someone came to my door with a gun. He came to the house asking for money but I didn't have any, so he took some items from the house",abuse
1159,,My husband's brother stole $500 from us let's talk about someone being beyond mad more like furious.,abuse
1160,,I found out someone stole my identity. They completely cleared out my bank account and maxed out my credit cards. I am so mad.,abuse
1161,,I am so scared to live in my neighborhood. There is people that come around shooting their guns.,abuse
1162,,"Last week, they arrested 9 people for animal cruelty at a nearby farm and the place was littered with dead and sick and dying animals that they weren't taking care of.",abuse
1163,,One time someone came to my door with a gun. He robbed my house,abuse
1164,,People who steal make me crazy. I watched some people come into my driveway and try to take my spare gas can!,abuse
1165,,"Yesterday, at the grocery store I saw a lady spanking her child. The child only asked for a candy bar and was not being out of the norm for children.",abuse
1166,,"Recently a man tried to break into our house. It was late at night, and he was kicking the door. My entire family was scared as we waited for the police to show up.",abuse
1167,,Someone packed into my car the other day at the supermarket and put a big dent in it. I've only had the car for 10 days.,abuse
1168,,Someone had pull a stick prank on me and slashed my car tires and bashed my windshield in at my apartment complex.,abuse
1169,,One time someone came to my door with a gun. He wanted money but I didn't have any so he stole some items from the house,abuse
1170,,"There was a guy at a place I worked at that was stalking me. He would write me creepy letters, come by to talk to me, and try to follow me home.",abuse
1171,,"On my way to work, a goose stole my toupee. We just hired a new secretary, Christy, and I need my hairpiece in order to impress her. I am so furious with that goose, I could wring its neck.",abuse
1172,,I went shopping at the mall the other day. I was really tired and sat down for a few minutes. I placed the bags beside me and looked away for a second and the next thing I knew the bags were gone. I am still so mad,abuse
1173,,My mother in law was recently placed in hospice and is not expected to live much longer.,health
1174,,Going to the dentist always worries me.,health
1175,,I ate all of the candy we had in the house one night. I felt so bad afterwards but it was so great in the moment,health
1176,,"i hate watching my parents smoke, it makes me really sad to think they could face cancer as a concequence",health
1177,,I just ate a whole box of cookies.,health
1178,,I just fell of my diet by eating a big bag of peanut M&Ms.,health
1179,,My cousin had a heart cath and the surgeon sent for me to come to the operating room.,health
1180,,My wife's cousin was sent to the hospital and was placed in a medically induced coma with something having to do with his lungs.,health
1181,,I have been doing very well on my diet and last night I decided to eat a whole large pizza by myself!,health
1182,,"My son had to have surgery to remove his tonsils last month. I know it's a routine procedure, but I could not sit down for the entire time and I was so relieved when they said everything went just fine.",health
1183,,"I feel so bad about myself, ate too many sweets. I'm suppose to be on a diet.",health
1184,,my dad is going to get his heart checked tomorrow. i am so nervous about it.,health
1185,,I have many health problems that have prevented me from having children. I use to be so upset everytime I saw people with children but now I have learned to be content in my situtation,health
1186,,My daughter called and said they were taking my newborn grandson to the doctor to have a chest xray because he was having some breathing trouble. I worried all day long until I got the phone call telling me everything was ok. They live far away so I tend to worry even more since I can't be there.,health
1187,,My little grandson was admitted to the hospital a few days ago. He is still having testing and it's so hard to wait around to get the test results back to find out what is wrong.,health
1188,,I have a dentist appointment tomorrow and it's starting to make me a bit nervous. I have to get a filling replaced.,health
1189,,"I ate a whole cake by myself, I'm suppose to be on a diet. It's so hard!",health
1190,,I was very worried the they told me I needed heart surgery.,health
1191,,My eye is itchy and my eyelid is droopy.,health
1192,,I am feeling so nervous about my dad going to check his heart tomorrow. I really hope no bad news comes off it.,health
1193,,I am trying a new diet to treat my Lupus. I really am hoping it works b/c the next steps are some powerful meds that really make me nervous to take,health
1194,,A couple years ago I got hospitalized and diagnosed with MS. The whole experience was terrible.,health
1195,,I went to Aldi the other day and bought a bunch of German chocolate bars. I then sat and stuffed myself and now I feel really bad about it. No self-control!,health
1196,,I felt very sad when I found out that my mother had lung cancer 6 months ago.,health
1197,,I have a impacted wisdom tooth. I need to go to the dentist but I am apprehensive about it.,health
1198,,I was sad to hear my mom is in the emergency room again.,health
1199,,I felt bad when I cheated on my diet. I found out I gained 2 pounds this past week!,health
1200,,About 6 years ago I was diagnosed with cancer.,health
1201,,I went to the dentist for the first time in five years recently. I had a toothache and wanted to get it looked at,health
1202,,I sat in the waiting room last weekend and waited and waited to find out how my dad's neck surgery turned out. This was one of those last ditch effort to keep his cervical vertebrae from having to be fused.,health
1203,,I went to the dentist yesterday to have a cavity filled. I was extremely nervous about going after being told that it was close to my nerve.,health
1204,,"I should be eating healthier and working out, but instead I've been doing the opposite.",health
1205,,I ate way too much today! Was suppose to be on a diet. Ate a cupcake and pizza.,health
1206,,I hadn't been to the dentist in years but one day I made an appointment. One of my teeth had been bothering me a lot,health
1207,,I love Pirate peanut butter cookies. I'm really stressed today so I bought a box of those cookies and ate an entire sleeve of them. I feel pretty bad because I wrecked my dieting for at least two days.,health
1208,,"I recently found out that I have been diagnosed HIV positive, and I'm at a complete loss for words. I don't even know how to go on anymore.",health
1209,,My mom is having weight loss surgery. Im worried the risks are too dangerous.,health
1210,,My son is in so much pain,health
1211,,Sometimes at night I wake up and eat extremely unhealthy food. I put peanut butter and Nutella on chocolate chip cookies.,health
1212,,"Imagine, I started working out two months ago, only to weigh myself and I have gained some weight.",health
1213,,"I ate like a pig on my birthday, and while I enjoyed myself, I think I gained a few pounds from that day alone! I shouldn't have eaten so much and I regret it.",health
1214,,"Shortly after my nephew was born, i received a call from my sister informing me that he had a genetic disease.",health
1215,,I was very anxious when my son had his tonsils taken out.,health
1216,,I ate the entire cake.,health
1217,,Having a toothache is irritating,health
1218,,When I interviewed for this job I had to wait for a couple weeks to hear back about it. It was kinda rough.,assessment
1219,,I'm so angry at myself. I was in my performance review today and I passed wind in front of my boss.,assessment
1220,,I am really nervous about my upcoming job interview. I am concerned I might screw it up.,assessment
1221,,I felt really anxious about my job interview back in September.,assessment
1222,,"When I interviewed for the job I have now, I didn't hear back from them with a solid response for a month. I kept having to check with them to make sure I hadn't been forgotten.",assessment
1223,,Once I had an interview for a job. I didn't feel prepared for it at all.,assessment
1224,,I've got a job interview set up for next week and I'm really nervous!,assessment
1225,,One time I was so nervous to look at my grade for my final exam.,assessment
1226,,I'm nervous about taking a test soon.,assessment
1227,,I barely passed my finals,assessment
1228,,School is starting up soon and I'm worried I may not be able to keep up with all of the homework.,assessment
1229,,I am nervous for my college test.,assessment
1230,,One time I had an in person interview for a job. I did not really feel prepared for it,assessment
1231,,I'm nervous about taking a test soon.,assessment
1232,,School starts a week from today and I am getting fairly nervous!,assessment
1233,,"I had gone on an interview for a job I wanted. I was waiting to hear back, but it was taking a really long time for them to contact me.",assessment
1234,,I have a job interview lined up for next week. i am feeling so nervous about it.,assessment
1235,,I was waiting in the waiting room for my last job interview.,assessment
1236,,I am worried about take my finals this week.,assessment
1237,,After having 4 interviews none of the employers had called me after 1 week which stressed me out.,assessment
1238,,"I have a big test on Monday. I am so nervous, I haven't been able to sleep at all.",assessment
1239,,I had a job interview.,assessment
1240,,I had an unprofessional job interview.,assessment
1241,,I gotta go to this serious interview tomorrow.,assessment
1242,,I had a video job interview.,assessment
1243,,"Last summer when I took my drivers test, I was so nervous that I would fail.",assessment
1244,,I think about my mother and I getting really sad. She has been dead for 15 years now.,death
1245,,"My dog, Riley had to be put to sleep due to congestive heart failure. It was one of the hardest things I had to do.",death
1246,,I was sad when my dog died.,death
1247,,I miss my dog who died last year.,death
1248,,My father passed away when I was 33 years old.,death
1249,,I found out that my childhood cat passed away yesterday.,death
1250,,"My dog is over at the vet for 4 days and it makes the house feel super lonly, I really am looking forward to my dog comming back.",death
1251,,My father unexpected passed away around 2 1/2 years ago. We never thought he would be leaving us this soon and it was very traumatic to me.,death
1252,,My border collie had to be put down due to a neurological disorder that could not be treated.,death
1253,,"My father passed away in November, it's made me feel empty ever since.",death
1254,,My sister's cat got sick and had to be put down last week. Feels bad. I'd known the cat for 14 years and was always her favourite person.,death
1255,,I was feeling pretty reminiscent when we went on vacation. I starting thinking about the last vacation we had with my father before he passed away.,death
1256,,I have this knife that I carry everyday. My dad gave it to me before he died.,death
1257,,"I found my cat the other day. She had been missing for 3 days. I found her on the side of the road, guts in the gutter.",death
1258,,We have a doberman for over 8 years. He passed away last spring. It was a hard time for our family.,death
1259,,My father passed away 2 1/2 years ago. We didn't know he had a life-threatening illness and it really traumatized our family. The unexpected loss was so agonizing and painful for us.,death
1260,,I'm upset that my neighbor's dog is sick.,death
1261,,I felt so alone after my dog trevor passed away. he was always by my side over these years.,death
1262,,"Today when I went into my roommate's office to fix the internet, I noticed the collar of his old cat that passed away. I miss her.",death
1263,,I left the front door unlocked this morning and our dog got out. I can't believe I would be so careless.,death
1264,,My mother died.,death
1265,,Seeing a statue we made for a recently passed away pet made me really sad. It was such a fitting tribute to her life and the love we had for her.,death
1266,,My dog just passed away two nights ago. She was 12 years old.,death
1267,,I had to take my beloved dog to the humane society when I had to move back in with my mother after my terrible breakup with my ex. SHe said I absolutely couldnt have her at her house.,death
1268,,I'm devastated by my mother's death.,death
1269,,I always get down and blue whenever memories of my dad pops into my head. He passed away last year and i miss him so much.,death
1270,,I was sad when my dad died,death
1271,,"When I was going through my old photo albums this morning, I came across a picture of my mother and me. It reminded me of a much simpler time, before she abandoned the family and joined a nudist colony. Ah, she was the best. I miss her.",death
1272,,"A friend of mine was in a car accident. Unfortunately, he did not make it.",death
1273,,I found my cat dead on the side of the road. I was so hurt and distraught I couldn't even drive home.,death
1274,,Our dog passed away after 8 years of having in the family.,death
1275,,my brother would've turned 34 today,death
1276,,Recently my grandma passed away. She lived far from us most of our lives but at the end she was sick so we moved her down here and I really had fun connecting with her as an adult again. It was a hard day when she died,death
1277,,I've got a pet hamster that hasn't been doing well. I'm scared that he might not live much longer.,death
1278,,"When my sister passed away several years ago, I had such a hard time with the loss. I felt very much separate from others in dealing with my grief.",death
1279,,"My cat had to stay overnight at the vet recently. They had to keep her for x-rays, I was so worried.",death
1280,,My dog is really sick. I don't know if he's going to make it.,death
1281,,I always get sad thinking about my mom.. She passed away when i was 12.,death
1282,,I felt really alone when my dog passed away last month. He was always by my side all the time.,death
1283,,"My rabbit died last year, I miss her to this day.",death
1284,,My goldfish died.,death
1285,,"I took my cat to the vet because he wasn't acting normal, and we found out he was going to have to be put down.",death
1286,,"Earlier this week, my cat Sam passed away. He was 17 years old. It's been odd not having him asleep at my feet while I work.",death
1287,,My mom called me last week to let me know our childhood dog passed away.,death
1288,,"My dog, who had been with me for 13 years, died a few years ago. It was so difficult to wrap him in a blanket, and bury him. I was heartbroken.",death
1289,,My 32 year-old son died of a sudden heart attack. I was with him the day before.,death
1290,,I am upset that I have to tell my young daughter her hamster died today.,death
1291,,"My cat hasn't been feeling well this past week, I think there might be something really wrong.",death
1292,,"One time when I was letting my cat outside, it ran out into the streets and got ran over.",death
1293,,"When my grandparents died, I was extremely upset for a few months.",death
1294,,I got a call in the middle of the night during college that one of my best friends had been in a fatal car crash.,death
1295,,We are going on vacation next week and we can't bring our dog. I feel so bad that we have to board her in at a kennel. She's going to be so sad.,death
1296,,My cat had to have surgery on her leg and I was so scared and worried for her.,death
1297,,I miss my puppy. She passed away recently and it was really sudden and sad.,death
1298,,"Years ago I found my beagle dead from kidney failure, he had not gone quietly.",death
1299,,My girlfriend's cat has cancer and we cannot afford the operation.,death
1300,,My aunt recently passed away after a long battle with Alzheimer's disease. I'm so sad at the loss.,death
1301,,My pet has a tumor.,death
1302,,"I passed by my grandma's old house today, she passed last year. It really brought me down.",death
1303,,The little kitten I rescued last Friday passed away.,death
1304,,I feel down and blue whenever thoughts about my brother pop into my head. We lost him 5 years ago,death
1305,,My dad died of cancer in 2012.,death
1306,,"Our cat had to many health problems, so we had to put him down.",death
1307,,I got news that my grandfather passed away. Nobody saw it coming.,death
1308,,"Last month I came home from work and noticed my cat wasn't feeling well, so I rushed her to the vet. I had to put her down.",death
1309,,I went to the petstore with my dog and he had an accident in front of everyone. He had the saddest look on his face.,death
1310,,"When I was a kid, my granpa bought me a dog. The dog was supposed to be a hunting dog, and he didn't want to keep it because I had made it into a pet. He ended up giving it away.",death
1311,,"My grandmother recently passed. We were close, so it's been hard.",death
